1. += (Add Equals):
    SQL> UPDATE Employee SET EMPSALARY = EMPSALARY + 5000 WHERE EMPID = 101;
    
    1 row updated.
    
    SQL> SELECT * FROM Employee;
    
         EMPID EMPNAME              EMPCITY               EMPSALARY    PINCODE
    ---------- -------------------- -------------------- ---------- ----------
           101 Himanshu             Pune                     105000     411001
           102 Soni                 Mumbai                    60000     400001
           103 Ayush                Delhi                  48000.75     110001
           104 Tanmay               Nagpur                    45000     440001
           105 Mayur                Kerala                    65000     682001
           106 Sonakshi             Hyderabad                 10000     500001
           107 Himanshi             Goa                       30000     403001
           108 Kapil                Bhubaneswar               50000     751001
           109 Saket                Nagpur                    20000     440026
           110 Zaid                 Pune                      25000     411002
    
    10 rows selected.

2. -= (Subtract Equals):
    SQL> UPDATE Employee SET EMPSALARY = EMPSALARY - 2000 WHERE EMPID = 102;
    
    1 row updated.
    
    SQL> SELECT * FROM Employee;
    
         EMPID EMPNAME              EMPCITY               EMPSALARY    PINCODE
    ---------- -------------------- -------------------- ---------- ----------
           101 Himanshu             Pune                     105000     411001
           102 Soni                 Mumbai                    58000     400001
           103 Ayush                Delhi                  48000.75     110001
           104 Tanmay               Nagpur                    45000     440001
           105 Mayur                Kerala                    65000     682001
           106 Sonakshi             Hyderabad                 10000     500001
           107 Himanshi             Goa                       30000     403001
           108 Kapil                Bhubaneswar               50000     751001
           109 Saket                Nagpur                    20000     440026
           110 Zaid                 Pune                      25000     411002
    
    10 rows selected.

3. *= (Multiply Equals):
    SQL> UPDATE Employee SET EMPSALARY = EMPSALARY * 2 WHERE EMPID = 103;
    
    1 row updated.
    
    SQL> SELECT * FROM Employee;
    
         EMPID EMPNAME              EMPCITY               EMPSALARY    PINCODE
    ---------- -------------------- -------------------- ---------- ----------
           101 Himanshu             Pune                     105000     411001
           102 Soni                 Mumbai                    58000     400001
           103 Ayush                Delhi                   96001.5     110001
           104 Tanmay               Nagpur                    45000     440001
           105 Mayur                Kerala                    65000     682001
           106 Sonakshi             Hyderabad                 10000     500001
           107 Himanshi             Goa                       30000     403001
           108 Kapil                Bhubaneswar               50000     751001
           109 Saket                Nagpur                    20000     440026
           110 Zaid                 Pune                      25000     411002
    
    10 rows selected.

4. /= (Divide Equals):
    SQL> UPDATE Employee SET EMPSALARY = EMPSALARY / 2 WHERE EMPID = 104;
    
    1 row updated.
    
    SQL> SELECT * FROM Employee;
    
         EMPID EMPNAME              EMPCITY               EMPSALARY    PINCODE
    ---------- -------------------- -------------------- ---------- ----------
           101 Himanshu             Pune                     105000     411001
           102 Soni                 Mumbai                    58000     400001
           103 Ayush                Delhi                   96001.5     110001
           104 Tanmay               Nagpur                    22500     440001
           105 Mayur                Kerala                    65000     682001
           106 Sonakshi             Hyderabad                 10000     500001
           107 Himanshi             Goa                       30000     403001
           108 Kapil                Bhubaneswar               50000     751001
           109 Saket                Nagpur                    20000     440026
           110 Zaid                 Pune                      25000     411002
    
    10 rows selected.

5. %= (Modulo Equals Equivalent):
    SQL> UPDATE Employee SET PINCODE = MOD(PINCODE, 1000) WHERE EMPID = 105;
    
    1 row updated.
    
    SQL> SELECT * FROM Employee;
    
         EMPID EMPNAME              EMPCITY               EMPSALARY    PINCODE
    ---------- -------------------- -------------------- ---------- ----------
           101 Himanshu             Pune                     105000     411001
           102 Soni                 Mumbai                    58000     400001
           103 Ayush                Delhi                   96001.5     110001
           104 Tanmay               Nagpur                    22500     440001
           105 Mayur                Kerala                    65000          1
           106 Sonakshi             Hyderabad                 10000     500001
           107 Himanshi             Goa                       30000     403001
           108 Kapil                Bhubaneswar               50000     751001
           109 Saket                Nagpur                    20000     440026
           110 Zaid                 Pune                      25000     411002
    
    10 rows selected.
